{
  "schema_version": "0.1.0",
  "titulo": "Ciclo XIII — Fichas mecânicas propostas de Dungeon World",
  "estado": "revisao_autoral_pendente",
  "aprovacao_autoral": false,
  "efetiva_canon": false,
  "fonte_dos_monstros": "data/propostas/eldroth-ecologia-monstruosa-dw.json",
  "regra_base": "https://www.dungeonworldsrd.com/monsters/",
  "metodo": "Respostas explícitas às perguntas de criação de monstros. PV, dano e armadura do DW derivam da ficção, nunca de ND D&D.",
  "resumo": {
    "fichas": 8,
    "com_pv": 7,
    "sem_pv_por_ficcao": 1,
    "statblocks_aprovados": 0
  },
  "fichas": [
    {
      "id": "ecologia-xiii:ficha:coruja-do-eco-emprestado",
      "ordem_de_revisao": 1,
      "criatura_origem_id": "ecologia-xii:criatura:coruja-do-eco-emprestado",
      "nome": "Coruja do Eco Emprestado",
      "tipo_carcaca_proposto": "fera_sobrenatural",
      "status": "proposta_mecanica_para_revisao",
      "aprovacao_autoral": false,
      "ocorrencia_confirmada": false,
      "modo": "estatizado",
      "instinto": "Conservar para si o último som ouvido e devolvê-lo quando ninguém pode confiar nele.",
      "movimentos": [
        {
          "nome": "Eco que Acusa",
          "texto": "Repetir uma confissão no momento em que ela mais compromete um inocente.",
          "origem_ciclo": "xii"
        },
        {
          "nome": "Silêncio de Ninho",
          "texto": "Subtrair os sons de aviso de uma pequena passagem.",
          "origem_ciclo": "xii"
        },
        {
          "nome": "Voo sem Testemunha",
          "texto": "Sair do alcance visual quando uma vítima tenta provar que a viu.",
          "origem_ciclo": "xii"
        }
      ],
      "organizacao": {
        "proposta_dw": "solitario",
        "justificativa": "Escolha narrativa de organização herdada do ciclo XII; não confirma distribuição populacional."
      },
      "decisoes": {
        "porte": "miudo",
        "defesa": "carne",
        "destaques": [
          "trapaça",
          "adaptacao",
          "magia"
        ],
        "ataque": {
          "nome": "Bicada ao distraído",
          "opcoes": []
        },
        "tracos": [
          "ardiloso"
        ],
        "justificativa": "Coruja pequena, solitária e ameaçadora principalmente pela desinformação."
      },
      "ficha_dw": {
        "estado": "proposta_mecanica_nao_aprovada",
        "pv": 12,
        "armadura": 0,
        "dano": {
          "faces": 8,
          "modificador": -2,
          "expressao": "d8-2",
          "minimo": 1
        },
        "ataque": {
          "nome": "Bicada ao distraído",
          "alcances": [
            "mao"
          ],
          "opcoes": []
        },
        "tags": [
          "solitario",
          "miudo",
          "furtivo",
          "magico",
          "ardiloso",
          "mao"
        ]
      },
      "resolucao_ficcional": {
        "risco": "Imita sons sem revelar de onde vêm.",
        "alternativas": [
          "Verificar a voz com testemunhas independentes.",
          "Conferir o som com outras testemunhas",
          "Afastar-se sem perseguir a ave",
          "Criar um sinal não vocal"
        ]
      },
      "calculo_fonte": {
        "regras": "Dungeon World SRD — Making Monsters",
        "url": "https://www.dungeonworldsrd.com/monsters/",
        "origem_dnd_ou_nd": false
      }
    },
    {
      "id": "ecologia-xiii:ficha:besouros-da-casca-riscada",
      "ordem_de_revisao": 2,
      "criatura_origem_id": "ecologia-xii:criatura:besouros-da-casca-riscada",
      "nome": "Besouros da Casca Riscada",
      "tipo_carcaca_proposto": "fauna",
      "status": "proposta_mecanica_para_revisao",
      "aprovacao_autoral": false,
      "ocorrencia_confirmada": false,
      "modo": "estatizado",
      "instinto": "Decompor a madeira morta e proteger a própria postura de vibrações excessivas.",
      "movimentos": [
        {
          "nome": "Cortina de Serragem",
          "texto": "Encobrir uma marca no chão quando a madeira é sacudida.",
          "origem_ciclo": "xii"
        },
        {
          "nome": "Casca em Movimento",
          "texto": "Fazer uma trilha parecer recém-usada por um animal maior.",
          "origem_ciclo": "xii"
        },
        {
          "nome": "Defesa do Ninho",
          "texto": "Enxamear os pés de quem destrói a madeira habitada.",
          "origem_ciclo": "xii"
        }
      ],
      "organizacao": {
        "proposta_dw": "horda",
        "justificativa": "Escolha narrativa de organização herdada do ciclo XII; não confirma distribuição populacional."
      },
      "decisoes": {
        "porte": "miudo",
        "defesa": "couro",
        "destaques": [
          "adaptacao"
        ],
        "ataque": {
          "nome": "Mandíbulas defensivas",
          "opcoes": [
            "armas_fracas"
          ]
        },
        "tracos": [],
        "justificativa": "Insetos minúsculos de exoesqueleto e mandíbula fraca, abundantes em madeira caída."
      },
      "ficha_dw": {
        "estado": "proposta_mecanica_nao_aprovada",
        "pv": 3,
        "armadura": 1,
        "dano": {
          "faces": 4,
          "modificador": -2,
          "expressao": "d4-2",
          "minimo": 1
        },
        "ataque": {
          "nome": "Mandíbulas defensivas",
          "alcances": [
            "mao"
          ],
          "opcoes": [
            "armas_fracas"
          ]
        },
        "tags": [
          "horda",
          "miudo",
          "mao"
        ]
      },
      "resolucao_ficcional": {
        "risco": "Confundir ranhuras de insetos com códigos pode causar perseguições injustas.",
        "alternativas": [
          "Examinar as cascas antes de declarar espionagem.",
          "Evitar troncos com postura",
          "Usar outro suporte estrutural",
          "Observar os rastros antes de concluir perseguição"
        ]
      },
      "calculo_fonte": {
        "regras": "Dungeon World SRD — Making Monsters",
        "url": "https://www.dungeonworldsrd.com/monsters/",
        "origem_dnd_ou_nd": false
      }
    },
    {
      "id": "ecologia-xiii:ficha:cardos-que-bebem-cinza",
      "ordem_de_revisao": 3,
      "criatura_origem_id": "ecologia-xii:criatura:cardos-que-bebem-cinza",
      "nome": "Cardos que Bebem Cinza",
      "tipo_carcaca_proposto": "flora",
      "status": "proposta_mecanica_para_revisao",
      "aprovacao_autoral": false,
      "ocorrencia_confirmada": false,
      "modo": "estatizado",
      "instinto": "Armazenar nutrientes da terra ferida e espalhar sementes após perturbações.",
      "movimentos": [
        {
          "nome": "Poeira que Revela",
          "texto": "Marcar de fuligem mãos que mexeram na planta.",
          "origem_ciclo": "xii"
        },
        {
          "nome": "Espinhos na Passagem",
          "texto": "Fechar uma passagem estreita ao rebrotar sobre madeira podre.",
          "origem_ciclo": "xii"
        },
        {
          "nome": "Semente Retida",
          "texto": "Espalhar sementes quando uma fogueira é apagada no solo.",
          "origem_ciclo": "xii"
        }
      ],
      "organizacao": {
        "proposta_dw": "grupo",
        "justificativa": "Escolha narrativa de organização herdada do ciclo XII; não confirma distribuição populacional."
      },
      "decisoes": {
        "porte": "pequeno",
        "defesa": "carne",
        "destaques": [
          "adaptacao"
        ],
        "ataque": {
          "nome": "Espinhos de defesa",
          "opcoes": [
            "armas_fracas"
          ]
        },
        "tracos": [
          "ardiloso"
        ],
        "justificativa": "Plantas baixas em pequenos agrupamentos; espinhos rasos, ameaça principal ambiental."
      },
      "ficha_dw": {
        "estado": "proposta_mecanica_nao_aprovada",
        "pv": 6,
        "armadura": 0,
        "dano": {
          "faces": 4,
          "modificador": 0,
          "expressao": "d4",
          "minimo": 1
        },
        "ataque": {
          "nome": "Espinhos de defesa",
          "alcances": [
            "corpo_a_corpo"
          ],
          "opcoes": [
            "armas_fracas"
          ]
        },
        "tags": [
          "grupo",
          "pequeno",
          "ardiloso",
          "corpo_a_corpo"
        ]
      },
      "resolucao_ficcional": {
        "risco": "A fuligem não prova corrupção mágica; queimar destrói recursos.",
        "alternativas": [
          "Isolar e analisar o solo sem destruir o plantio.",
          "Isolar uma amostra",
          "Observar solo e água",
          "Evitar queimada sem diagnóstico"
        ]
      },
      "calculo_fonte": {
        "regras": "Dungeon World SRD — Making Monsters",
        "url": "https://www.dungeonworldsrd.com/monsters/",
        "origem_dnd_ou_nd": false
      }
    },
    {
      "id": "ecologia-xiii:ficha:micelio-das-vozes-partidas",
      "ordem_de_revisao": 4,
      "criatura_origem_id": "ecologia-xii:criatura:micelio-das-vozes-partidas",
      "nome": "Micélio das Vozes Partidas",
      "tipo_carcaca_proposto": "flora",
      "status": "proposta_mecanica_para_revisao",
      "aprovacao_autoral": false,
      "ocorrencia_confirmada": false,
      "modo": "sem_estatisticas",
      "instinto": "Distribuir sinais de perturbação entre corpos de fungo e madeira.",
      "movimentos": [
        {
          "nome": "Voz em Tronco Alheio",
          "texto": "Devolver uma palavra incompleta como se tivesse sido dita por outra pessoa.",
          "origem_ciclo": "xii"
        },
        {
          "nome": "Raiz em Alerta",
          "texto": "Fazer sinais se propagarem por uma zona de raízes sem indicar sua origem.",
          "origem_ciclo": "xii"
        },
        {
          "nome": "Colônia Rompida",
          "texto": "Liberar partículas que obscurecem rastros quando o fungário é ferido.",
          "origem_ciclo": "xii"
        }
      ],
      "organizacao": {
        "proposta_dw": "horda",